{
  "coverage": {
    "client": "Challenge derivation timed separately; no private-input masking, UI, or signing cost exists in R1.",
    "network": "Serialized byte counts are retained; transport latency, bandwidth, protocol framing, retransmission, and availability are unmeasured.",
    "preprocessing": "All five Q=G^T M objects remain in provider-measurements.json as a separate offline cost.",
    "privacy": "No privacy mechanism is implemented; the public toy model, inputs, intermediates, and output are disclosed.",
    "provider": "All 80 coded response equations timed separately; model execution and trace/subject timing remains in provider-measurements.json.",
    "storage": "Original retained JSON artifact bytes are counted; filesystem, Git, replication, indexing, and long-term retention overhead are unmeasured.",
    "verifier": "Independent relation replay remains in verifier-measurements.json."
  },
  "environment": {
    "implementation": "CPython",
    "machine": "arm64",
    "platform": "macOS-14.4-arm64-arm-64bit-Mach-O",
    "processor": "arm",
    "python": "3.14.2"
  },
  "experiment_id": "E-009",
  "limitations": [
    "This measurement was designed after observing R1 and is exploratory, not preregistered confirmatory evidence.",
    "It imports the frozen provider implementation to isolate operations and is not an independent code path.",
    "Client challenge derivation is local deterministic hashing; a beacon, signed interactive challenge, network, and anti-grinding mechanism would have additional cost.",
    "Provider response construction excludes model execution, trace construction, preprocessing, serialization, network, and failure recovery, which are reported or marked separately.",
    "Tiny Python timings and byte ratios do not predict production accelerator behavior."
  ],
  "measured_at": "2026-09-20T19:53:48Z",
  "protocol": {
    "clock": "time.perf_counter_ns",
    "relationship_to_r1": "Post-hoc decomposition of the frozen combined challenge/response measurement; no R1 input, transcript, result, or preregistered claim changed.",
    "repetitions": 1000,
    "statistics": [
      "minimum_ns",
      "median_ns",
      "p95_ns",
      "mean_ns"
    ],
    "warmup": 100
  },
  "run_id": "E-009-R1",
  "schema_version": "aeye.e009-cost-decomposition.v0",
  "serialized_sizes_bytes": {
    "all_original_r1_json_artifacts": 102048,
    "audit_file": 66470,
    "challenge_terms_canonical_json": 15761,
    "coded_responses_canonical_json": 8865,
    "provider_bundle": 85584
  },
  "status": "exploratory-post-hoc",
  "timings": {
    "audit_json_parsing": {
      "mean_ns": 235299,
      "median_ns": 236354,
      "minimum_ns": 221375,
      "p95_ns": 256208
    },
    "audit_json_serialization": {
      "mean_ns": 236652,
      "median_ns": 235083,
      "minimum_ns": 223875,
      "p95_ns": 257167
    },
    "client_challenge_derivation": {
      "mean_ns": 704952,
      "median_ns": 703584,
      "minimum_ns": 668125,
      "p95_ns": 749417
    },
    "provider_coded_response_construction": {
      "mean_ns": 702566,
      "median_ns": 699687,
      "minimum_ns": 657792,
      "p95_ns": 751125
    }
  }
}
